宝贝ID,标题,价格,玩具类型,适用年龄,品牌
45105421124,新品大号蜜蜂手推车学步益智儿童玩具幼儿园礼物地摊热卖玩具批发,3.65,单杆手推玩具,"18个月,2岁",4
36421128017,新品创意发光45度角擦边陀螺闪光小玩具批发义乌热卖地摊货源儿童,1.59,陀螺,"3岁,4岁,5岁,6岁,7岁,8岁,9岁,10岁",2
543674126623,儿童电子琴卡通益智玩具1-3岁早教婴幼儿玩具卡通琴音乐玩具琴,5.35,其它玩具,"3岁,4岁,5岁,6岁,7岁,8岁",2
40415550893,无线遥控电动二通汽车模型遥控赛车 车模警车儿童益智玩具车批发,16.8,塑胶玩具,"6岁,7岁,8岁,9岁,10岁",7
543643323771,婴儿摇铃玩具益智软胶发声可爱动物手摇铃耐摔牙胶0-1岁宝宝玩具,3.85,其它玩具,"3个月,6个月,12个月,18个月",2
535647669951,创意军事坦克模型回力玩具车好玩的儿童玩具地摊热卖义乌货源批发,8.8,其他,"3岁,4岁,5岁,6岁,7岁,8岁",10
551053390911,六一礼品创意电动发光救援车音乐消防车模型儿童万向轮玩具车批发,14.9,塑胶玩具,"2岁,3岁,4岁,5岁,6岁,7岁",3
35750823403,创意儿童宝宝玩具义乌厂家直销上链发条小爬娃儿热卖地摊货源批发,1.55,其它玩具,"2岁,3岁,4岁,5岁,6岁",2
540524795725,新品儿童积木熊出没拼插积木启蒙拼装熊大熊二益智玩具宝宝3-6岁,22.5,拼搭积木,"3岁,4岁,5岁,6岁,7岁,8岁,9岁,10岁,11岁,12岁,13岁,14岁",1
550680496523,夏季热卖苹果造型手摇风创意新款儿童风扇玩具扇夜市地摊货源批发,2.29,其它玩具,"3岁,4岁,5岁,6岁,7岁,8岁,9岁,10岁,11岁,12岁",3
552179640607,异形益智魔方三阶减压魔方金字塔3阶五魔方镜面比赛解压玩具套装,4.99,塑胶玩具,"6岁,7岁,8岁,9岁,10岁,11岁,12岁,13岁,14岁",16
551625132527,六一儿童礼物创意回力车飞机套装消防警车男孩玩具车地摊货源批发,7.9,其它玩具,"3岁,4岁,5岁,6岁,7岁,8岁,9岁,10岁,11岁,12岁,13岁,14岁",3
540882092170,遥控坦克车越野车玩具军事模型可充电动汽车大炮儿童男孩3-6周岁,39.8,其它玩具,"2岁,3岁,4岁,5岁,6岁,7岁,8岁,9岁",3
537180206236,3D立体拼图纸质创意DIY手工拼图厨房DIY积木手工制作儿童玩具模型,1.29,其它玩具,"3岁,4岁,5岁,6岁,7岁,8岁,9岁",2
36058620932,创意婚庆充气圆形气球义乌小商品热卖地摊货源心形小玩具厂家批发,0.09,,,2
35722423659,创意万向电动音乐车发光儿童汽车男生礼物地摊热卖货源玩具车批发,6.9,其它玩具,"3岁,4岁,5岁,6岁,7岁,8岁,9岁",3
529339155756,创意手摇风扇小扇子手动 儿童礼物幼儿园 夏季热销义乌玩具批发,2.39,其它玩具,"3岁,4岁,5岁,6岁",3
45123664231,新品创意小号手推蜜蜂车儿童益智学步幼儿园地摊玩具热卖义乌货源,2.85,其他,"3岁,4岁,5岁",3
531372212963,创意电动发光音乐坦克车万向车儿童玩具车地摊货源热卖玩具批发,9.8,其它玩具,"3岁,4岁",3
539091956756,创意海绵粘贴纸益智玩具EVA贴画幼儿园儿童手工制作diy早教批发,0.95,,"3岁,4岁,5岁,6岁,7岁,8岁",11
529337915679,创意带算盘磁性画写板 早教益智儿童玩具热卖 地摊货源批发义乌,8.85,,"3岁,4岁,5岁,6岁,7岁,8岁,9岁",15
35797606083,热卖地摊货源创意 义乌小商品海豚鱼拉线螺旋桨飞机玩具批发厂家,1.85,其它玩具,"3岁,4岁,5岁,6岁",19
538585695146,幼儿园手工制作材料创意益智玩具EVA儿童手工贴画diy立体贴纸水晶,1.28,,"3岁,4岁,5岁,6岁,7岁,8岁,9岁",2
545974803385,正版平博士密码卡通儿童玩具吹泡泡玩具电动发光泡泡机泡泡水批发,6.9,其它玩具,"3岁,4岁,5岁,6岁,7岁,8岁,9岁,10岁,11岁,12岁,13岁,14岁",20
543616921912,大象音乐发光电话机0-3岁益智电动早教机故事机儿童玩具小孩礼物,9.85,塑胶玩具,"3岁,4岁,5岁,6岁,7岁,8岁",2
544106286825,儿童玩具公主换装洋娃娃套装婚纱小天使女孩过家家玩具套装娃娃,11.8,普通娃娃,"3岁,4岁,5岁,6岁,7岁,8岁,9岁,10岁,11岁,12岁,13岁,14岁",2
528153854399,2017创意新款磁性钓鱼玩具 桶装早教益智儿童玩具批发地摊货免邮,3.25,其他,"3岁,4岁,5岁",3
543670894727,婴幼儿学习机卡通电话机智能多功能早教机带话筒唱歌机儿童小玩具,23.8,电玩具,"3岁,4岁,5岁,6岁,7岁,8岁,9岁,10岁,11岁,12岁",2
552252552332,换装天使娃娃大礼盒套装女孩过家家衣服洋娃娃玩具婚纱公主小洋伞,10.9,普通娃娃,"2岁,3岁,4岁,5岁,6岁,7岁,8岁,9岁,10岁,11岁,12岁,13岁,14岁",2
537252200486,创意电动万向工程车音乐发光儿童玩具批发挖掘机男孩礼物地摊货源,9.8,其它玩具,"3岁,4岁,5岁,6岁,7岁,8岁,9岁,10岁,11岁,12岁",2
533823532718,发条玩具批发上链跳绳水果小人儿童玩具批发义乌地摊货源热卖免邮,1.78,其它玩具,"2岁,3岁,4岁",3
37665896062,2017创意惯性工程车推土机男孩儿童玩具车批发新奇礼物地摊热卖,3.2,其它玩具,"3岁,4岁,5岁,6岁",3
543719829706,儿童泡泡机自动泡泡枪 发光音乐儿童玩具户外吹泡泡小孩礼物批发,13.85,塑胶玩具,"3岁,4岁,5岁,6岁,7岁,8岁,9岁,10岁,11岁,12岁,13岁,14岁",20
539410602755,创意儿童玩具批发礼物大号吸盘软弹枪眼镜玩具枪套装地摊货源义乌,5.6,,"2岁,3岁,4岁,5岁,6岁,7岁,8岁",4
552412394814,女孩过家家儿童玩具礼物套装大礼盒新款换装娃娃仿真洋娃娃公主,6.49,普通娃娃,"2岁,3岁,4岁,5岁,6岁,7岁,8岁,9岁,10岁,11岁,12岁,13岁,14岁",2
528705813655,正版猪猪侠公仔模型玩具大号吸卡套装益智儿童玩具地摊货源批发,16.8,其它玩具,"3岁,4岁,5岁,6岁,7岁,8岁",9
539523705313,玩具手枪音乐发光电锯枪电动枪震动益智儿童礼物3岁地摊货源批发,18.5,其它玩具,"2岁,3岁,4岁,5岁,6岁,7岁,8岁",2
538539816052,新奇特创意儿童玩具男生女生玩具卡通笑脸印章小玩具地摊货源批发,2.98,其它玩具,"3岁,4岁,5岁,6岁,7岁,8岁",3
551135995408,儿童会动的玩具大号电动发光恐龙走路三角龙仿真行走动物模型男孩,59.9,电玩具,"2岁,3岁,4岁,5岁,6岁,7岁,8岁,9岁,10岁,11岁,12岁,13岁",2
529055709096,创意超人迷你手摇小风扇儿童玩具小孩礼物玩具批发地摊货源免邮,2.39,其他,"3岁,4岁,5岁",3
537219457175,新款幼儿园手工制作材料创意3D方程式赛车模型宝宝DIY玩具益智,1.65,,"3岁,4岁,5岁,6岁",4
543665285542,儿童玩具早教益智乐器卡通音乐琴1-3岁宝宝电子琴男女孩玩具热卖,3.75,塑胶玩具,"3岁,4岁,5岁,6岁,7岁,8岁",2
537105495948,新款音乐发光万向轮电动车好玩的导弹玩具车益智军事模型男孩玩具,9.8,其它玩具,"3岁,4岁,5岁,6岁,7岁,8岁",2
553219890599,创意发光女孩闪光头饰蝴蝶发箍夜市热卖礼物地摊儿童玩具货源批发,2.49,其它玩具,"3岁,4岁,5岁,6岁,7岁,8岁,9岁,10岁,11岁,12岁,13岁,14岁",3
530449665002,发光玩具批发光纤手指灯闪光夜市热卖货源儿童玩具地摊义乌厂家,0.58,其它玩具,"3岁,4岁,5岁,6岁,7岁,8岁,9岁,10岁",3
547389639874,创意拉线工程车3款新奇特惯性滑行小车儿童玩具礼物地摊货源批发,1.79,其它玩具,"2岁,3岁,4岁,5岁,6岁",3
543695068744,幼儿童益智迷你仿真Q版小家具电动女孩过家家玩具天平称认知玩具,6.5,仿真生活家电,"3岁,4岁,5岁,6岁,7岁,8岁,9岁,10岁,11岁,12岁",22
527397362582,创意儿童小相机义乌玩具批发1-2元以下礼物益智玩具地摊货源热卖,2.05,其它玩具,"3岁,4岁,5岁,6岁",3
551091439907,儿童玩具指尖陀螺成人休闲减压三叶旋转创意手指陀螺地摊货源批发,5.59,其它玩具,"3岁,4岁,5岁,6岁,7岁,8岁,9岁,10岁,11岁,12岁,13岁,14岁",4
543694848992,电动仿真电饭锅小家电儿童过家家玩具迷你系列女孩宝宝厨房厨具,7.85,仿真生活家电,"3岁,4岁,5岁,6岁,7岁,8岁,9岁,10岁,11岁,12岁",22
541851060973,儿童益智卡通发光投影相机仿真照相机宝宝投影玩具礼物地摊货批发,2.55,其它玩具,"3岁,4岁,5岁,6岁,7岁,8岁,9岁",3
37283032735,热卖无毒卡通猪泡泡枪义乌公园吹泡泡地摊货源儿童泡泡水玩具批发,3.3,塑胶玩具,"3岁,4岁,5岁,6岁,7岁,8岁,9岁,10岁,11岁,12岁,13岁,14岁",20
540658025950,玩具车万向特警战车男孩电动玩具车万向音乐发光车儿童玩具地摊,9.8,其它玩具,"3岁,4岁,5岁,6岁,7岁",2
40601929263,热卖创意飞速动力惯性摩托车 新奇礼物儿童地摊玩具批发厂家直销,1.6,其它玩具,"2岁,3岁,4岁,5岁,6岁",0
552307335477,儿童节创意演出服装表演天使蝴蝶翅膀魔法棒三件套发光小玩具批发,5.9,,,4
553256161651,新款创意合金变形汽车机器人模型 儿童礼物男孩地摊益智玩具批发,14.9,其它玩具,"3岁,4岁,5岁,6岁,7岁,8岁,9岁,10岁,11岁,12岁,13岁,14岁",2
522077917778,新品 幼儿园礼物卡通眼镜儿童DIY手工制作创意贴画拼图玩具批发,1.88,,"3岁,4岁,5岁,6岁",0
44918365380,创意海绵黄色水机套圈圈幼儿园礼品新奇地摊热卖货源儿童玩具批发,1.69,其它玩具,"3岁,4岁,5岁,6岁,7岁,8岁,9岁,10岁,11岁",3
522078457232,幼儿园儿童DIY手工制作小家具画创意贴画EVA手工DIY粘贴玩具批发,2.25,,"3岁,4岁,5岁,6岁,7岁",0
551744063939,儿童3-5岁男女宝宝护士过家家仿真小医生玩具套装医药箱打针工具,23.8,仿真医生玩具,"3岁,4岁,5岁,6岁,7岁,8岁,9岁,10岁,11岁,12岁",2
545979147913,创意音乐发光电动鸭子七彩灯光万向车儿童玩具摆地摊货源批发热卖,7.85,其它玩具,"3岁,4岁,5岁,6岁,7岁,8岁,9岁,10岁,11岁,12岁,13岁,14岁",3
552571161278,儿童音乐益智早教学习琴多功能仿真小钢琴0-3-6岁宝宝电子琴女孩,11.9,电玩具,"3岁,4岁,5岁,6岁,7岁,8岁",21
539627383673,儿童大颗粒塑料拼插积木宝宝益智拼装3-6周岁1-2男孩女孩小孩玩具,55.0,拼搭积木,"12个月,18个月,2岁,3岁,4岁,5岁,6岁,7岁",2
551715398940,儿童初学者架子鼓3-6岁小孩爵士鼓大号敲打鼓乐器男女孩玩具套装,25.8,其它玩具,"3岁,4岁,5岁,6岁,7岁,8岁,9岁,10岁,11岁,12岁,13岁,14岁",18
552007245556,新款美丽小天使儿童玩具女孩礼物换装娃娃公主婚纱礼盒套装过家家,15.9,普通娃娃,"2岁,3岁,4岁,5岁,6岁,7岁,8岁,9岁,10岁,11岁,12岁,13岁,14岁",2
546826767033,创意卡通音乐旋转风车鲸鱼手腕带儿童发光手表男女孩地摊玩具批,8.88,其它玩具,"3岁,4岁,5岁,6岁,7岁,8岁,9岁,10岁,11岁,12岁,13岁,14岁",14
542199076372,新品电动玩具车防空导弹车坦克车音乐发光军事模型3-6岁男生玩具,9.8,其它玩具,"3岁,4岁,5岁,6岁,7岁,8岁",2
547572252871,创意大号惯性工程车新奇特男孩礼物好玩的儿童玩具车地摊货源批发,2.9,其它玩具,"2岁,3岁,4岁,5岁,6岁",3
543889179481,儿童电动玩具发光走路仿真会叫三角龙行走动物恐龙玩具模型男孩,45.0,电玩具,"3岁,4岁,5岁,6岁,7岁,8岁,9岁,10岁,11岁,12岁,13岁,14岁",2
539409835003,创意可爱猴子手摇风扇儿童益智手动玩具新奇小孩礼物地摊货源批发,2.45,其他,"3岁,4岁,5岁,6岁",4
36514978453,2017热卖海豚泡泡枪批发吹泡泡带泡泡水生日礼物儿童玩具地摊货源,3.65,塑胶玩具,"3岁,4岁,5岁,6岁,7岁,8岁,9岁",20
539678458590,创意发条玩具上链火车头发条3岁宝宝益智儿童玩具批发 地摊货源,1.55,其它玩具,"2岁,3岁,4岁,5岁,6岁",3
37444707994,玩具批发儿童创意熊猫泡泡枪吹泡泡夜市热卖地摊货源批发益智礼物,3.3,其它玩具,"3岁,4岁,5岁,6岁,7岁,8岁,9岁,10岁",2
524619920574,幼儿园diy材料包花盆手工制作创意EVA手工儿童玩具地摊货源批发,3.25,,"3岁,4岁,5岁,6岁",0
543618945546,婴幼儿摇铃球玩具 宝宝3-6个月手抓球爬行运动 婴儿球软胶洞洞球,3.9,其它玩具,"3个月,6个月,12个月,18个月,2岁,3岁",2
543812646033,幼儿童玩具仿真迷你小家电过家家吸尘器模型生活居家男女孩礼物,7.55,仿真生活家电,"3岁,4岁,5岁,6岁,7岁,8岁,9岁,10岁,11岁,12岁",22
543626161846,儿童玩具瓢虫电动车音乐发光昆虫益智卡通动物万向小孩玩具车礼物,14.5,电玩具,"3岁,4岁,5岁,6岁,7岁,8岁,9岁,10岁,11岁,12岁,13岁,14岁",2
552235232611,儿童创意玩具惯性回力飞机海军舰队男孩益智吸卡套装地摊货源批发,7.9,其它玩具,"3岁,4岁,5岁,6岁,7岁,8岁,9岁,10岁,11岁,12岁,13岁,14岁",3
552028581381,新品皮卡丘打鼓笔创意卡通益智小玩具儿童礼物地摊热卖货源批发,2.29,其它玩具,"3岁,4岁,5岁,6岁,7岁,8岁,9岁,10岁,11岁,12岁,13岁,14岁",3
522191965500,幼儿园礼物儿童DIY手工制作卡通包手工制作创意贴画拼图玩具批发,3.25,,"3岁,4岁,5岁,6岁",2
522151739462,创意贴画拼图立体制作卡通手工包幼儿园过家家儿童DIY制作批发,1.55,,"3岁,4岁,5岁,6岁",0
544106282196,创意儿童电动闪光玩具旋转风车手表小孩发光手腕带地摊货源批发,7.25,塑胶玩具,"3岁,4岁,5岁,6岁,7岁,8岁,9岁,10岁",14
522078297513,幼儿园玩具批发皇冠帽儿童DIY手工制作画手工制作创意贴画拼图,2.25,,"3岁,4岁,5岁,6岁",0
544017279596,儿童益智过家家玩具厨房切切乐女孩礼物砧板宝宝切蔬果切切看热卖,14.8,,"3岁,4岁,5岁,6岁,7岁,8岁,9岁,10岁",22
528726320954,猪猪侠五灵守卫者变形五灵王套装铁拳虎音乐儿童玩具地摊货源批发,18.5,塑胶玩具,"3岁,4岁,5岁,6岁,7岁,8岁,9岁,10岁,11岁,12岁,13岁",9
550785319010,六一儿童节礼物创意儿童海盗水机传统套圈圈玩具夜市地摊货源批发,1.79,其它玩具,"3岁,4岁,5岁,6岁,7岁,8岁,9岁,10岁,11岁",3
545094454423,创意卡通粉红拉线小汽车儿童玩具车小孩宝宝小车地摊货源批发热卖,1.68,其它玩具,"3岁,4岁,5岁,6岁",3
553140906353,创意儿童吸卡消防救援玩具车套装警示牌小孩礼物义乌地摊货源批发,7.9,其它玩具,"3岁,4岁,5岁,6岁,7岁,8岁,9岁,10岁,11岁,12岁,13岁,14岁",3
37466992184,创意老虎泡泡枪热卖义乌儿童玩具吹泡泡 小礼品礼物地摊货源批发,3.3,塑胶玩具,"3岁,4岁,5岁,6岁,7岁,8岁,9岁,10岁,11岁,12岁,13岁",20
35802384340,拉线110警车小汽车 幼儿园儿童益智礼物 热卖摆地摊货源玩具批发,1.75,其它玩具,"2岁,3岁,4岁,5岁,6岁",10
521890491877,幼儿园玩具批发儿童DIY手工制作纸盘子画 手工制作创意贴画拼图,0.88,,"3岁,4岁,5岁,6岁",0
543644663788,儿童趣味玩具踏板比赛益智骨牌积木制机关成人多米诺骨牌玩具礼物,15.8,,"3岁,4岁,5岁,6岁,7岁,8岁,9岁,10岁,11岁,12岁,13岁,14岁",12
553534986797,创意80后经典怀旧手摇夜光碰碰球摇摇球撞球夜市玩具地摊货源批发,0.79,其它玩具,"3岁,4岁,5岁,6岁,7岁,8岁,9岁,10岁,11岁,12岁,13岁,14岁",3
532994602666,义乌玩具批发回力飞机12个装儿童创意玩具地摊热卖货源夜市新奇特,7.9,塑胶玩具,"3岁,4岁,5岁,6岁,7岁,8岁,9岁",10
543742043514,新款过家家仿真Q版小家电电熨斗单只装迷你玩具电动儿童女生玩具,7.55,仿真生活家电,"3岁,4岁,5岁,6岁,7岁,8岁,9岁,10岁,11岁,12岁",22
541256147554,遥控警车可充电儿童电动玩具车大方向盘重力感应漂移赛车男孩礼物,28.8,电玩具,"2岁,3岁,4岁,5岁,6岁,7岁,8岁,9岁",2
545940561990,儿童泡泡机不漏水手动泡泡枪益智卡通宝宝吹泡泡水玩具儿童泡泡液,7.88,其它玩具,"3岁,4岁,5岁,6岁,7岁,8岁,9岁,10岁,11岁,12岁,13岁",20
529389246092,新品 创意玩具热卖儿童益智磁力画板写字板早教玩具义乌地摊货源,8.85,,"3岁,4岁,5岁,6岁,7岁,8岁,9岁,10岁,11岁,12岁",15
543661881179,儿童早教益智玩具卡通音乐琴早教机带话筒0-3-6岁幼儿宝宝学习机,28.8,其它玩具,"3岁,4岁,5岁,6岁,7岁,8岁",2
544114479515,儿童玩具投影满天星手表音乐小乌龟手腕带男女孩发光玩具地摊批发,7.55,塑胶玩具,"3岁,4岁,5岁,6岁,7岁,8岁,9岁,10岁,11岁,12岁",14
543636819112,0-1岁婴幼儿摇铃3-6个月宝宝拼接动物手摇铃牙胶男女孩玩具袋装,7.9,其它玩具,"3个月,6个月,12个月,18个月",2
522080118518,幼儿园儿童DIY手工制作花篮子画创意编制EVA手工DIY粘贴玩具批发,2.65,,"3岁,4岁,5岁,6岁",2
551065941768,儿童大号电动音乐发光车仿真工程车万向轮油罐货车男孩益智玩具车,14.9,电玩具,"2岁,3岁,4岁,5岁,6岁,7岁,8岁",3
538658337414,创意婴儿卡通小熊手摇铃儿童玩具小孩好玩的地摊货源玩具批发热卖,3.5,其它玩具,"3岁,4岁,5岁,6岁",3
522171062085,幼儿园玩具批发EVA儿童DIY手工制作小风车画创意贴画手工粘贴拼图,1.55,,"3岁,4岁,5岁,6岁",0
533790993106,发条玩具上链跳绳大象儿童玩具批发义乌好玩的 地摊货源热卖免邮,1.78,其它玩具,"2岁,3岁,4岁",3
551081926272,六一儿童节礼物新款电动音乐发光车万向轮工程车模型儿童玩具车,14.9,电玩具,"2岁,3岁,4岁,5岁,6岁,7岁,8岁,9岁,10岁,11岁,12岁",3
540520509637,婴幼儿摇铃小鱼0-1岁3-6-12个月早教益智玩具手摇铃婴儿安抚玩具,2.55,其它玩具,"6个月,12个月,18个月",2
36214799042,玩具电动车越野汽车翻跟斗特技儿童批发厂家热卖地摊货源玩具批发,3.55,其它玩具,"2岁,3岁,4岁,5岁,6岁,7岁,8岁,9岁,10岁",3
546783957758,儿童电动音乐车工程车电动玩具车万向搅拌车模型男孩玩具车批发,18.5,电玩具,"3岁,4岁,5岁,6岁,7岁,8岁,9岁,10岁,11岁,12岁",2
543627278103,大号仿真幼童过家家玩具发声婴儿双层娃娃床礼盒套装女孩礼物包邮,49.0,仿真房间/家具,"3岁,4岁,5岁,6岁,7岁,8岁,9岁,10岁,11岁,12岁",2
543672634097,儿童益智动物世界卡通动物积木拼装塑料大颗粒3-6周岁玩具积木,46.8,拼搭积木,"3岁,4岁,5岁,6岁,7岁,8岁,9岁,10岁,11岁,12岁",2
544114247390,创意卡通音乐手表飞机旋转风车手腕带儿童男孩女孩发光玩具批发,7.35,塑胶玩具,"3岁,4岁,5岁,6岁,7岁,8岁,9岁,10岁,11岁,12岁",14
543694488413,新款过家家仿真Q版小家电单只装迷你缝纫机玩具电动童女生玩具,7.55,仿真生活家电,"3岁,4岁,5岁,6岁,7岁,8岁,9岁,10岁,11岁,12岁",22
44242610103,儿童公园吹泡泡亲子互动玩具卡通青蛙泡泡枪义乌地摊货源热卖批发,3.3,塑胶玩具,"3岁,4岁,5岁,6岁,7岁,8岁,9岁,10岁,11岁",20
546831242583,创意玩具笑脸小海星动转向发光儿童玩具车10元以下地摊玩具批发,10.8,其它玩具,"3岁,4岁,5岁,6岁,7岁,8岁,9岁,10岁,11岁,12岁,13岁,14岁",3
541592384250,摩天轮乐园轨道积木电动火车百变魔法轨道拼装火车益智儿童玩具,19.9,塑胶玩具,"3岁,4岁,5岁,6岁,7岁,8岁,9岁,10岁,11岁,12岁",6
522151463307,儿童DIY手工制作动物创意贴画拼图过家家 女孩玩具批发地摊热卖,2.65,其它玩具,"3岁,4岁,5岁,6岁",4
546273141690,儿童玩具大号宝宝夏季玩沙子挖沙漏水车转轮铲子工具沙滩玩具套装,19.9,,"18个月,2岁,3岁,4岁,5岁,6岁,7岁,8岁,9岁",2
549698359290,儿童早教学习小孩故事机 音乐发光多功能益智机器人电话玩具0-3岁,15.9,其它玩具,"12个月,18个月,2岁,3岁,4岁,5岁,6岁",2
550339533001,大号儿童惯性滑行导弹车仿真模型玩具男孩火箭车战车小玩具运输车,18.9,其它玩具,"2岁,3岁,4岁,5岁,6岁",13
543621521908,早教益智幼儿小象手摇铃新生儿宝宝摇铃按铃0-1岁 婴儿玩具牙胶,3.85,其它玩具,"3个月,6个月,12个月,18个月",2
541012296041,创意发条玩具上链跳绳卡通兔小孩玩具3岁以上地摊货源玩具批发,1.95,其它玩具,"2岁,3岁,4岁,5岁,6岁",3
528725788435,正版猪猪侠面具发光音乐五灵守卫儿童益智玩具变身战队创意礼品,16.8,塑胶玩具,"3岁,4岁,5岁",9
547790825984,创意儿童发光皇冠陀螺闪光男孩宝宝礼物夜市地摊货源玩具批发热卖,5.79,其它玩具,"3岁,4岁,5岁,6岁,7岁,8岁,9岁,10岁,11岁,12岁,13岁,14岁",3
522060783761,创意过家家玩具批发儿童DIY手工制作拖鞋画手工制作创意贴画拼图,2.25,,"3岁,4岁,5岁,6岁,7岁",0
540522690300,新品手掌摇铃0-1岁婴幼儿摇铃3-6-12个月早教益智玩具手摇铃婴儿,2.65,其它玩具,"6个月,12个月,18个月",2
551675713112,过家家切切乐礼盒套装女孩厨房玩具儿童礼物宝宝做饭仿真厨具餐具,19.9,仿真厨房类,"3岁,4岁,5岁,6岁,7岁,8岁,9岁,10岁,11岁,12岁",2
537829232054,创意新品音乐电动万向轮发光越野车好玩儿童玩具自动转向热卖特价,9.8,其它玩具,"3岁,4岁,5岁,6岁,7岁,8岁,9岁,10岁,11岁,12岁",2
