宝贝ID,标题,价格,玩具类型,适用年龄,品牌
537396783238,创意新款回力小车惯性坦克 军事儿童玩具模型地摊货源玩具车批发,8.9,塑胶玩具,"3岁,4岁,5岁,6岁",3
36286235128,2017热卖大号仿真惯性挖土机儿童益智礼品创意义乌地摊货玩具批发,3.9,其它玩具,"3岁,4岁,5岁,6岁",3
35722000205,创意发光球闪光透明发光水晶弹力球儿童小玩具 夜市地摊货源批发,1.65,其它玩具,"3岁,4岁,5岁,6岁,7岁,8岁,9岁,10岁,11岁,12岁",3
550659732532,新款创意六一儿童节礼物音乐投影电动枪夜市地摊货源批发男孩玩具,9.9,其它玩具,"3岁,4岁,5岁,6岁,7岁,8岁,9岁,10岁,11岁,12岁,13岁,14岁",3
531877266868,发条玩具批发上链卡通动物青蛙儿童礼物宝宝玩具经典80后益智地摊,1.85,其它玩具,"3岁,4岁",3
550099429587,儿童拍拍球玩具幼儿园球类宝宝新款充气球小孩无毒西瓜皮球批,1.59,其它玩具,"2岁,3岁,4岁,5岁,6岁,7岁,8岁,9岁,10岁",4
39539028043,新款热卖闪光手环卡通手腕带小孩儿童玩具义乌厂家地摊货货源批发,0.9,其它玩具,"3岁,4岁,5岁,6岁,7岁,8岁,9岁,10岁,11岁,12岁,13岁,14岁",3
35753244214,经典发条玩具会跑会跳创意上链发条玩具动物儿童好玩的地摊货批发,1.77,其它玩具,"3岁,4岁,5岁,6岁",2
545516801138,创意新款发光翅膀背带儿童演出服装天使蝴蝶翅膀地摊货源玩具批发,4.55,其它玩具,"3岁,4岁,5岁,6岁,7岁,8岁,9岁,10岁,11岁,12岁",3
521019257989,创意 发光电动狗有声倒退狗会叫戴眼镜裙子儿童玩具批发地摊热卖,6.55,其它玩具,"3岁,4岁,5岁,6岁,7岁,8岁,9岁,10岁,11岁",3
36266985550,特价5号AA普通干电池 电动玩具配件 厂家直销批,1.0,,,5
550905064205,儿童地摊小玩具批发经典创意幼儿园礼物100只装竹蜻蜓飞天小玩意,9.9,,"3岁,4岁,5岁,6岁,7岁,8岁,9岁,10岁,11岁,12岁,13岁,14岁",4
544768785584,正版电动泡泡枪儿童卡通动物吹泡泡机全自动玩具热卖地摊货源批发,3.6,其它玩具,"3岁,4岁,5岁,6岁,7岁,8岁",3
36353085367,传统套圈圈玩具创意小鸟水机幼儿园礼品儿童礼物玩具批发地摊热卖,1.69,其他,"3岁,4岁,5岁,6岁,7岁,8岁,9岁,10岁,11岁,12岁,13岁,14岁",3
42577833473,创意电动飞机发光音乐万向车儿童玩具飞机模型拼装 玩具批发地摊,3.9,其它玩具,"2岁,3岁,4岁,5岁,6岁",3
544016559367,创意宝宝玩具婴儿摇铃中号小喇叭安全材质0-1岁早教儿童玩具批发,1.65,其它玩具,"3岁,4岁,5岁,6岁,7岁,8岁,9岁,10岁",3
541659214822,2017新款新奇创意音乐发光摇摆鱼电动鱼地摊货源儿童玩具批发热卖,4.25,其它玩具,"3岁,4岁,5岁,6岁,7岁,8岁,9岁",3
550977477078,创意早教益智飞天仙子40个装幼儿园儿童礼物地摊货源小孩玩具批发,9.9,,"3岁,4岁,5岁,6岁,7岁,8岁,9岁,10岁,11岁,12岁,13岁,14岁",4
530812936284,创意恐龙玩具卡装仿真恐龙模型小孩礼物宝宝玩具地摊货批发免邮,8.55,其它玩具,"3岁,4岁,5岁",3
40400203213,四通遥控车电动玩具汽车模型遥控赛车警车赛车儿童益智玩具车男孩,12.9,电玩具,"6岁,7岁,8岁,9岁",7
544115759872,创意泡泡棒吹泡泡机泡泡枪不漏水宝宝礼物 地摊货源儿童玩具批发,1.95,塑胶玩具,"3岁,4岁,5岁,6岁,7岁,8岁,9岁,10岁,11岁,12岁",17
549882564050,六一新品恐龙玩具模型回力小车迷你玩具车儿童节礼物地摊货源批发,4.39,其它玩具,"3岁,4岁,5岁,6岁,7岁,8岁,9岁,10岁,11岁,12岁,13岁,14岁",3
547794157516,创意音乐电动发光卡通仿真电锯儿童礼物地摊3-6岁小玩具货源批发,6.9,其它玩具,"3岁,4岁,5岁,6岁,7岁,8岁",3
535612234886,创意回力汽车玩具车套装12个装车模型地摊热卖货源儿童玩具车批发,8.8,其他,"3岁,4岁,5岁",3
527419046969,创意新品电动枪音乐玩具枪发光玩具地摊货源批热卖儿童礼物厂家,7.8,其它玩具,"3岁,4岁,5岁,6岁,7岁,8岁,9岁,10岁",3
539677826038,学步玩具大鸭子儿童手推车 婴儿宝宝手推杆玩具儿童地摊货源批发,1.85,单杆手推玩具,"12个月,18个月,2岁",4
545538490326,创意婴幼儿学习故事机小兔子早教玩具儿童益智地摊货小孩玩具批发,6.85,其它玩具,"3岁,4岁,5岁,6岁,7岁,8岁,9岁,10岁,11岁,12岁,13岁,14岁",3
36074765406,新奇创意炫彩飞碟枪飞盘射击枪 户外儿童益智 玩具批发地摊货源,1.88,其它玩具,"3岁,4岁,5岁,6岁,7岁,8岁,9岁,10岁,11岁,12岁,13岁,14岁",3
37941111428,创意地摊热卖儿童整蛊稀奇古怪整人发泄鸡惨叫鸡新奇 小玩具批发,1.55,发泄,"3岁,4岁,5岁,6岁,7岁,8岁,9岁,10岁",2
35877393642,热卖儿童创意玩具超人卡装模型生日礼物 义乌玩具批地摊货源,1.55,其他,"3岁,4岁,5岁,6岁,7岁,8岁,9岁,10岁",2
528109847799,创意儿童磁性钓鱼玩具益智宝宝1-2-3岁地摊货源热卖小孩玩具批发,2.65,其他,"3岁,4岁,5岁,6岁",3
521926312352,2017新款发光手指灯创意变色孔雀开屏小孩儿童玩具批发地摊货免邮,0.58,其它玩具,"3岁,4岁,5岁,6岁,7岁,8岁,9岁,10岁,11岁,12岁,13岁",3
549378588703,创意新款儿童闪光水晶球小孩弹力球热卖夜市地摊货源玩具批发免邮,1.59,其它玩具,"3岁,4岁,5岁,6岁,7岁,8岁,9岁,10岁,11岁,12岁,13岁,14岁",3
35722333869,创意发光极速弹射陀螺闪光陀螺玩具 义乌小商品夜市地摊货源批发,1.85,其它玩具,"3岁,4岁,5岁,6岁,7岁,8岁,9岁,10岁",3
538494418449,新品 儿童玩具四驱车男孩玩具车四驱赛车玩具电动车地摊货源批发,3.98,其它玩具,"3岁,4岁,5岁,6岁,7岁,8岁,9岁,10岁,11岁,12岁",3
520310825412,创意儿童发光刀玩具刀闪光刀剑男生礼物义乌货源地摊玩具批发免邮,2.85,其它玩具,"3岁,4岁,5岁",3
35721723963,创意发光飞机闪光玩具好玩的 儿童礼物地摊货源免邮儿童玩具批发,1.78,其他,"3岁,4岁,5岁,6岁,7岁,8岁,9岁,10岁,11岁,12岁,13岁",3
540407272609,儿童电子琴音乐电动早教益智琴婴幼儿小钢琴玩具男孩女孩1-3-6岁,2.9,塑胶玩具,"3岁,4岁,5岁,6岁,7岁,8岁",2
547751184046,创意仿木陀螺七彩发光音乐男孩闪光玩具儿童夜市热卖地摊货源批发,3.99,其它玩具,"3岁,4岁,5岁,6岁,7岁,8岁,9岁,10岁,11岁,12岁,13岁,14岁",3
45404080098,苹果磁性写字板画板 热销幼儿园礼品六一节儿童地摊玩具货源批发,2.25,,"3岁,4岁,5岁,6岁,7岁,8岁,9岁,10岁,11岁,12岁",15
538658965256,创意回力方程车卡丁车 儿童玩具汽车男孩地摊货源小汽车玩具批发,1.85,其它玩具,"2岁,3岁,4岁,5岁,6岁",3
44928090920,2017新款儿童水枪玩具3岁夏季玩沙戏水环保塑料儿童玩具批发地摊,2.55,,"3岁,4岁,5岁,6岁,7岁",2
36416065395,2元店创意整蛊拳头魔术弹簧枪 新奇好玩的儿童小玩具地摊货源批发,1.2,其他,"3岁,4岁,5岁,6岁,7岁,8岁",2
545566976422,创意女孩玩具套装热卖过家家儿童礼品女生礼物义乌玩具地摊货批发,6.85,其它玩具,"3岁,4岁,5岁,6岁,7岁,8岁,9岁,10岁,11岁,12岁",3
550715341924,六一儿童节男孩礼物创意新款电动发光音乐投影枪地摊玩具货源批发,4.9,其它玩具,"3岁,4岁,5岁,6岁,7岁,8岁,9岁,10岁,11岁,12岁,13岁,14岁",3
531145857565,儿童玩具学生魔方三阶百变魔方益智比赛减压玩具地摊货源热卖批发,5.55,塑胶玩具,"6岁,7岁,8岁,9岁,10岁,11岁,12岁,13岁,14岁",16
547812750733,创意发光玩具热卖音乐闪光陀螺新奇儿童小孩玩具夜市地摊货源批发,3.9,其它玩具,"3岁,4岁,5岁,6岁,7岁,8岁,9岁,10岁,11岁,12岁,13岁,14岁",3
548998614714,创意仿真蛇模型橡胶眼镜软胶假蛇整人恶搞道具儿童小玩具货源批发,2.49,其它玩具,"7岁,8岁,9岁,10岁,11岁,12岁,13岁,14岁,14岁以上",3
540349069906,儿童宝宝电话玩具卡通灯光音乐蘑菇电话机益智玩具0-3岁地摊货源,5.98,塑胶玩具,"2岁,3岁",2
545602185334,创意手工益智儿童玩具DIY项链手链串珠材料包男女孩地摊货源批发,3.25,其它玩具,"3岁,4岁,5岁,6岁,7岁,8岁,9岁,10岁,11岁,12岁",3
533204346200,特价创意变形大号套装模型发光礼物地摊货源义乌热卖儿童玩具批发,8.8,其它玩具,"3岁,4岁,5岁,6岁",3
42240451814,热卖惯性仿真模型2个装摩托车男生礼物儿童地摊货源义乌玩具批发,3.85,其它玩具,"2岁,3岁,4岁,5岁,6岁",0
521906910410,创意惯性双面翻斗车特技耐摔360玩具车转向儿童玩具批发地摊热卖,1.88,其它玩具,"3岁,4岁,5岁",3
541474263467,创意回力套装12个装消防救援车飞机消防车小汽车益智小玩具批发,9.5,其它玩具,"2岁,3岁,4岁,5岁,6岁",3
528166273868,2017创意新款音乐枪猴子电动枪满天星发光枪儿童玩具地摊货批发,7.8,其他,"3岁,4岁,5岁,6岁,7岁,8岁,9岁,10岁,11岁",3
35798891586,创意拉线装水车工程车小汽车儿童小玩意义乌玩具车批发地摊货源,1.98,其它玩具,"3岁,4岁,5岁,6岁",19
535703074519,创意玩具车批发吸卡特警混合版警车飞机儿童礼物3岁宝宝地摊货源,8.8,其他,"3岁,4岁,5岁,6岁,7岁",3
546827381933,儿童沙滩玩具车套装创意礼物益智挖沙玩具 地摊货源儿童玩具批发,1.9,,"18个月,2岁,3岁,4岁,5岁,6岁,7岁",3
536009750573,创意闪光棒七彩发光棒 夜市热卖地摊货源新奇特玩具发光玩具批发,2.98,其它玩具,"7岁,8岁,9岁,10岁",3
547742157633,卡通动物彩虹圈创意弹簧圈叠叠乐3-6岁儿童发光玩具地摊货源批发,1.99,其它玩具,"3岁,4岁,5岁,6岁,7岁,8岁,9岁,10岁,11岁,12岁,13岁,14岁",3
550634023902,建筑回力工程车挖土机套装小孩礼物混装吸卡装儿童节地摊玩具批发,7.9,其它玩具,"2岁,3岁,4岁,5岁,6岁",10
536083448292,2017创意新款拉线110警车好玩的儿童义乌地摊货源热卖玩具车批发,1.78,其它玩具,"3岁,4岁,5岁,6岁",3
550735773284,创意新款夏季热卖小象手摇风扇夜市地摊小玩具批发六一儿童节礼物,2.69,其它玩具,"3岁,4岁,5岁,6岁,7岁,8岁,9岁,10岁,11岁,12岁,13岁,14岁",3
548547222435,儿童沙滩玩具水枪 宝宝玩水玩具户外洗澡游泳漂流戏大号水枪批发,5.9,,"2岁,3岁,4岁,5岁,6岁,7岁,8岁,9岁,10岁,11岁,12岁,13岁,14岁,14岁以上",3
538535227251,创意惯性越野车沙滩车男孩儿童礼物小汽车义乌地摊货源玩具车批发,3.85,其它玩具,"2岁,3岁,4岁,5岁,6岁",3
530710879153,创意卡通音乐手机儿童益智男孩宝宝礼物义乌地摊热卖货源玩具批发,2.35,其他,"3岁,4岁,5岁",3
547382055156,创意热卖拉线发光爬行乌龟夜市男孩小礼品地摊货源儿童小玩具批发,1.69,其它玩具,"2岁,3岁,4岁,5岁,6岁",3
531379484499,夏季新款电动海豚泡泡枪吹泡泡棒新奇特热卖发光儿童玩具地摊货源,9.9,塑胶玩具,"3岁,4岁,5岁,6岁,7岁,8岁,9岁",20
527475911875,创意猴子彩虹圈音乐发光投影 儿童手提小灯笼地摊小玩具货源批发,1.99,其它玩具,"3岁,4岁,5岁",3
551079722431,创意儿童益智宝宝DIY积木拼图蘑菇钉组合拼插板3-6岁礼物玩具批发,2.9,其它玩具,"2岁,3岁,4岁,5岁,6岁,7岁,8岁,9岁,10岁,11岁,12岁,13岁,14岁",2
547644315780,儿童玩具批发卡通小飞机泡泡枪不漏水手动泡泡机户外吹泡泡地摊货,3.79,其它玩具,"3岁,4岁,5岁,6岁,7岁,8岁,9岁,10岁,11岁,12岁,13岁,14岁",3
545957998521,创意电动玩具仿真拉磨小马儿童好玩的小孩礼物地摊货免邮玩具批发,8.55,其它玩具,"3岁,4岁,5岁,6岁,7岁,8岁,9岁,10岁,11岁,12岁",3
546243180299,夏季热卖玩具水枪儿童水枪沙滩戏水玩沙小工具 夜市地摊货源批发,1.45,,"3岁,4岁,5岁,6岁,7岁,8岁,9岁,10岁,11岁,12岁",3
36500131840,热卖儿童创意益智上链发条毛绒小鸡热卖小孩玩具批发地摊货源厂家,1.69,其它玩具,"2岁,3岁,4岁,5岁,6岁",2
36267739775,特价正品7号电池儿童电动玩具电源配件 厂家直销1元4节地摊货批发,1.0,,,2
531846025844,新款蜜蜂车翻斗车特技电动玩具车自动翻儿童玩具批发地摊货源新奇,3.59,其它玩具,"2岁,3岁,4岁,5岁",3
528023284532,创意猴子秋千翻跟斗玩具宝宝礼物新奇特儿童玩具批发地摊货源热卖,1.59,其它玩具,"3岁,4岁,5岁",3
539522491801,创意拉线海盗船帆船好玩儿童小玩具新奇地摊货源热卖义乌玩具批发,1.95,其它玩具,"2岁,3岁,4岁,5岁,6岁",3
549710009588,大号套装儿童软胶婴幼儿戏水捏捏叫小鸭子 0-1岁女孩宝宝洗澡玩具,1.69,,"6个月,12个月,18个月,2岁,3岁",2
545912368452,创意音乐电子琴仿真吉他夜市好玩的儿童小玩具礼物地摊货热卖批发,3.85,其它玩具,"3岁,4岁,5岁,6岁,7岁,8岁,9岁,10岁,11岁,12岁,13岁,14岁",3
36414345451,创意拼图拼板数字拼音儿童益智早教玩具3-6岁 地摊货源小玩具批发,1.98,其它玩具,"3岁,5岁,6岁,7岁,8岁,9岁,10岁,11岁,12岁,13岁",2
536125595091,挖掘机玩具音乐发光电动车万向工程车小孩礼物儿童小男孩玩具批发,22.5,其它玩具,"3岁,4岁,5岁,6岁,7岁,8岁,9岁,10岁,11岁,12岁",2
42646163798,儿童手拍玩具大号彩色拍拍手演唱会助威道具地摊货源热卖玩具批发,0.55,其他,"3岁,4岁,5岁,6岁,7岁,8岁,9岁,10岁,11岁,12岁,13岁,14岁,14岁以上",4
532940035080,美食过家家创意儿童玩具益智早教宝宝礼物女生玩具地摊货热卖批发,8.8,其它玩具,"3岁,4岁,5岁,6岁,7岁",3
549640657338,创意大号惯性工程车挖土机挖掘机男孩新奇好玩的儿童玩具地摊批发,3.9,其它玩具,"2岁,3岁,4岁,5岁,6岁",3
36081332365,2017创意台球桌小玩具儿童礼物男孩义乌玩具批发地摊货源免邮好玩,1.55,其他,"3岁,4岁,5岁,6岁,7岁,8岁,9岁,10岁",3
35721027449,双闪飞箭飞天蘑菇义乌儿童发光小玩具批发地摊货源热卖创意新奇特,0.85,其它玩具,"3岁,4岁,5岁,6岁,7岁,8岁,9岁,10岁",3
544115359956,过家家厨房玩具仿真小家电电动热卖单只装迷你儿童玩具女孩童创意,6.9,仿真生活家电,"3岁,4岁,5岁,6岁,7岁,8岁,9岁,10岁,11岁,12岁",22
551091071810,创意儿童便携式手摇小风扇迷你可爱卡通小型学生环保风扇玩具批发,1.59,其它玩具,"3岁,4岁,5岁,6岁,7岁,8岁,9岁,10岁,11岁,12岁,13岁,14岁",3
550659216693,六一儿童节礼物发光超人模型手办创意新款男孩地摊货源小玩具批发,1.79,其它玩具,"3岁,4岁,5岁,6岁,7岁,8岁,9岁,10岁,11岁,12岁,13岁,14岁",3
542939108885,回力小车消防救援车消防车滑行小汽车工程车小玩具儿童玩具车批发,1.88,其它玩具,"3岁,4岁,5岁,6岁",3
547380519834,创意大号回力工程车挖机小车男孩好玩的儿童礼物地摊玩具货源批发,1.69,其它玩具,"2岁,3岁,4岁,5岁,6岁",3
549765831606,10元以下儿童小玩具批发创意棒棒糖发光棒女孩闪光棒夜市地摊货源,3.9,其它玩具,"3岁,4岁,5岁,6岁,7岁,8岁,9岁,10岁,11岁,12岁,13岁,14岁",3
39375321605,2017创意新款惯性工程车 槽罐水泥车汽车男生礼物儿童玩具车批发,4.95,其它玩具,"3岁,4岁,5岁,6岁",3
547510552253,迷你儿童玩具推土机工程车新奇特挖机益智儿童幼儿园礼品玩具批发,1.29,其它玩具,"2岁,3岁,4岁,5岁",4
37276995387,创意2元精品店儿童望远镜小玩具过家家礼物义乌热卖地摊货源批发,1.78,其他,"3岁,4岁,5岁,6岁,7岁,8岁,9岁,10岁",3
549736062191,创意新款炫彩魔法闪光棒发光棒夜市地摊货源热卖儿童发光玩具批发,1.99,其它玩具,"3岁,4岁,5岁,6岁,7岁,8岁,9岁,10岁,11岁,12岁,13岁,14岁",3
549536550945,回力小鸡滑行小车创意儿童卡通公鸡小玩具车鸡年热卖地摊货源批发,1.69,其它玩具,"2岁,3岁,4岁,5岁,6岁",3
39386028930,2017热卖惯性工程车货车拖斗车小汽车 义乌儿童玩具地摊货源批发,5.85,其它玩具,"3岁,4岁,5岁,6岁",3
36351422002,热卖创意苹果手机水机 儿童小玩意新奇特 热卖地摊货源小玩具批发,1.75,其它玩具,"3岁,4岁,5岁,6岁,7岁,8岁,9岁,10岁,11岁,12岁,13岁,14岁",3
546928423058,创意儿童卡通手敲琴拖拉小车宝宝益智敲打击乐器地摊玩具货源批,7.38,其它玩具,"3岁,4岁,5岁,6岁,7岁,8岁,9岁,10岁,11岁,12岁,13岁,14岁",3
45171930915,创意警车飞机轮公交车卡通车套装儿童礼品地摊货源热卖小玩具批发,9.6,其他,"3岁,4岁,5岁,6岁,7岁,8岁,9岁,10岁",3
550966828606,创意小礼品儿童玩具手摇风扇迷你卡通夏季手持小风扇地摊货源批发,2.59,其它玩具,"3岁,4岁,5岁,6岁,7岁,8岁,9岁,10岁,11岁,12岁,13岁,14岁",3
544066720474,大号泡泡棒沙滩小铲子工具泡泡枪公园吹泡泡户外亲子游戏玩具热卖,1.2,其它玩具,"3岁,4岁,5岁,6岁,7岁,8岁,9岁,10岁,11岁,12岁,13岁",17
551248890640,磁性钓鱼套装益智儿童钓鱼玩具小猫宝宝钓鱼池洗澡戏水男孩1-3岁,46.8,塑胶玩具,"12个月,18个月,2岁,3岁,4岁,5岁,6岁",2
522609190751,创意手提灯笼卡通彩虹圈玩具发光好玩的儿童益智礼物地摊玩具批,2.85,塑胶玩具,"3岁,4岁,5岁,6岁,7岁,8岁,9岁,10岁,11岁,12岁,13岁,14岁",8
549744152016,夜市地摊玩具批发热卖创意新款儿童俄罗斯方块游戏机小孩益智玩具,3.49,其它玩具,"3岁,4岁,5岁,6岁,7岁,8岁,9岁,10岁,11岁,12岁,13岁,14岁",3
552233560576,儿童小风车彩色大风车礼物diy手工幼儿园装饰户外玩具批发地摊,2.29,其它玩具,"3岁,4岁,5岁,6岁,7岁,8岁,9岁,10岁,11岁,12岁,13岁,14岁",4
550597738824,回力坦克车吸卡混装军事小车礼品套装创意儿童节玩具地摊货源批发,7.9,其它玩具,"3岁,4岁,5岁,6岁,7岁,8岁,9岁,10岁,11岁,12岁,13岁,14岁",3
543616473590,创意电动声控机器人模型智能感应儿童玩具早教音乐学习机小孩礼物,22.5,其它玩具,"3岁,4岁,5岁,6岁,7岁,8岁,9岁,10岁,11岁,12岁",2
541254875522,创意新款儿童玩具车发光音乐A梦电动车四轮万向车灯光新奇特汽车,9.8,其它玩具,"12个月,18个月,2岁,3岁,4岁,5岁,6岁",2
539853979136,新款创意回力小车直升飞机好玩的儿童惯性玩具批发地摊货免邮义乌,1.25,其它玩具,"2岁,3岁,4岁,5岁,6岁",3
529338111966,夏季热销多孔泡泡机吹泡泡玩具泡泡枪玩具创意新奇特地摊货源批发,1.95,其他,"3岁,4岁,5岁,6岁",2
536728628605,创意热卖回力惯性小汽车特警先锋 12辆巴士儿童玩具地摊货源批发,8.8,其它玩具,"3岁,4岁,5岁,6岁",3
530810980941,惯性玩具车大巴卡通玩具车公交车儿童礼物 地摊货源热卖玩具批发,1.75,其它玩具,"2岁,3岁,4岁,5岁",3
35798985871,创意热卖拉线卡通笑脸仿真电话车儿童过家家地摊货源 玩具车批发,1.85,其它玩具,"2岁,3岁,4岁,5岁,6岁",10
547387807548,创意回力特技360旋转车儿童小汽车夜市地摊小孩玩具车货源批发,1.79,其它玩具,"2岁,3岁,4岁,5岁,6岁",3
550661692854,儿童惯性工程车铲车挖掘机新款创意大号男孩夜市地摊货源玩具批发,2.9,其它玩具,"2岁,3岁,4岁,5岁,6岁",3
546104970758,新款弹跳小人新奇特创意小孩发光礼物地摊货热卖义乌儿童玩具批发,0.98,其它玩具,"3岁,4岁,5岁,6岁,7岁,8岁,9岁,10岁,11岁,12岁,13岁",3
544100858313,创意儿童玩具批发小雨伞泡泡棒吹泡泡好玩的泡泡水 地摊热卖玩具,2.25,其它玩具,"3岁,4岁,5岁,6岁,7岁,8岁,9岁,10岁,11岁,12岁",17
544099790786,电动仿真电冰箱小家电厨房厨具儿童过家家玩具迷你系列女孩小宝宝,7.35,仿真生活家电,"3岁,4岁,5岁,6岁,7岁,8岁,9岁,10岁,11岁,12岁",22
522566248653,创意音乐电动爬兵发光兵人 会爬行男生礼物儿童玩具批发地摊热卖,9.85,其它玩具,"3岁,4岁,5岁,6岁,7岁,8岁,9岁,10岁,11岁,12岁",3
529405509010,新品 创意儿童玩具热卖 卡通磁性画写板早教玩具义乌地摊货源批,6.9,其他,"3岁,4岁,5岁,6岁",3
42711696783,儿童发光手拍玩具新奇特聚会演唱会道具夜市热卖地摊货源玩具批发,0.55,其它玩具,"3岁,4岁,5岁,6岁,7岁,8岁,9岁,10岁",3
545939669017,儿童过家家仿真切蔬菜益智早教认知切切乐套装男女孩切水果玩具,12.9,,"3岁,4岁,5岁,6岁,7岁,8岁,9岁,10岁",22
542978775847,新款回力小车军事导弹车模型儿童玩具创意小孩礼物玩具货源批发,1.88,其它玩具,"3岁,4岁,5岁,6岁",3
35754637865,创意儿童上链发条小玩具海盗咬人整蛊小跳球义乌稀奇地摊货源批发,1.75,其它玩具,"3岁,4岁,5岁,6岁",3
529100790989,儿童玩具水枪透明水枪戏水玩具大号宝宝儿童玩具批发地摊货源义乌,2.55,,"2岁,3岁,4岁,5岁,6岁",3
530910185416,儿童沙滩玩具玩沙铲雪工具玩具铲子宝宝礼物玩具批地摊货源热卖,3.55,,"3岁,4岁,6岁,7岁,8岁,9岁,10岁",2
548130516925,新款电动音乐吉他创意电子琴发光玩具新奇特儿童礼物地摊货源批发,5.9,其它玩具,"3岁,4岁,5岁,6岁,7岁,8岁,9岁,10岁,11岁,12岁,13岁,14岁",10
541592740476,婴儿手推车学步小车宝宝益智玩具创意小礼品1-3岁男女小孩玩具,16.8,娃娃玩具,"12个月,18个月,2岁",2
553220562597,创意发光星星仙女棒五角星闪光棒魔法棒女孩夜市儿童玩具货源批发,2.29,其它玩具,"3岁,4岁,5岁,6岁,7岁,8岁,9岁,10岁,11岁,12岁,13岁,14岁",3
550367550663,惯性大号导弹拖车军事人物运输车仿真模型工程车儿童玩具男孩礼物,9.9,其它玩具,"2岁,3岁,4岁,5岁,6岁",13
549518534180,儿童乐器玩具益智多功能女孩音乐琴婴幼儿宝宝认知早教海豚故事机,13.9,塑胶玩具,"3岁,4岁,5岁,6岁",2
538658221958,新品 卡通彩色儿童口哨奶瓶摇铃创意小玩具地摊货源3岁玩具批发,1.85,其它玩具,"3岁,4岁,5岁,6岁",3
547297272467,创意儿童卡通回力小汽车儿童礼物小孩好玩的玩具夜市地摊货源批发,1.29,其它玩具,"2岁,3岁,4岁,5岁,6岁",3
537318544352,创意新品热卖光纤发光面具酒吧生日舞会派对儿童玩具地摊货源批发,1.9,其它玩具,"3岁,4岁,5岁,6岁,7岁,8岁,9岁",3
521826021046,电动轨道车儿童玩具汽赛车组装玩具火车益智男孩3岁玩具批免邮,16.9,其它玩具,"3岁,4岁,5岁,6岁,7岁,8岁,9岁,10岁,11岁,12岁",2
547306204530,儿童玩具车卡通惯性工程车宝宝礼物小车男孩创意新奇地摊货源批发,3.39,其它玩具,"2岁,3岁,4岁,5岁,6岁",3
532936159396,创意儿童回力警车12个套装摩托车新款3岁以上地摊货源玩具车批发,7.9,其他,"3岁,4岁,5岁,6岁",3
540661582201,创意新款回力小车惯性玩具飞机混合套装儿童玩具批发礼物热卖货源,9.5,塑胶玩具,"3岁,4岁,5岁,6岁",10
42768874029,创意热卖吸卡超人套装义乌小商品 儿童地摊玩具批发 2元店货源,1.99,其他,"3岁,4岁,5岁,6岁,7岁,8岁,9岁,10岁",3
538540548218,创意电动四驱车玩具车好玩的3岁以上小孩玩具批发地摊货源10以下,3.85,其他,"3岁,4岁,5岁,6岁,7岁,8岁,9岁,10岁",3
545955506006,创意卖萌毛绒小黄鸡发夹小鸡年发卡礼物女孩儿童玩具地摊货源批发,1.45,其它玩具,"3岁,4岁,5岁,6岁,7岁,8岁,9岁,10岁,11岁,12岁,13岁,14岁",3
547355238181,创意迷你小汽车热卖卡通汽车回力工程车儿童玩具男孩地摊货源批发,1.29,其它玩具,"2岁,3岁,4岁,5岁,6岁",10
540662535716,电动搅拌工程车水泥车音乐发光车电动玩具热卖创意男孩玩具3-6岁,9.8,其它玩具,"18个月,2岁,3岁,4岁,5岁,6岁,7岁",2
545959606207,儿童玩具电动小爬娃0-3-6岁宝宝发光玩具好玩的爬行地摊货源批发,9.5,其它玩具,"3岁,4岁,5岁,6岁,7岁,8岁,9岁,10岁,11岁,12岁,13岁,14岁",3
547792011631,创意发光牛角演唱闪光玩具发箍头饰夜市儿童玩具夜市地摊货源批发,1.49,其它玩具,"3岁,4岁,5岁,6岁,7岁,8岁,9岁,10岁,11岁,12岁,13岁,14岁",3
537166359199,儿童电动火车百变轨道车儿童3-6岁宝宝礼物拼装套装小火车比赛,16.9,电玩具,"3岁,4岁,5岁,6岁,7岁,8岁,9岁",2
35798309577,创意儿童玩具拉线警车小汽车地摊货源幼儿园宝宝礼物批发新奇义乌,1.69,其他,"3岁,4岁,5岁,6岁,7岁,8岁,9岁,10岁",2
537215013586,大号音乐万向发光电动车工程车挖掘机推土机 益智儿童玩具车男孩,9.8,其它玩具,"3岁,4岁,5岁,6岁,7岁,8岁",2
543694756340,幼儿童迷你生活小家电过家家男女孩玩具仿真厨房具烤箱微波炉热卖,8.55,仿真生活家电,"3岁,4岁,5岁,6岁,7岁,8岁,9岁,10岁,11岁,12岁",22
43104145123,创意儿童玩具枪电动模型玩具枪音乐发光枪大号地摊玩具批 男孩,9.8,其它玩具,"3岁,4岁,5岁,6岁,7岁,8岁,9岁,10岁,11岁,12岁,13岁,14岁",3
543827067334,创意过家家女孩玩具迷你小家电模型儿童礼物仿真洗衣机单只装特价,8.85,仿真生活家电,"3岁,4岁,5岁,6岁,7岁,8岁,9岁,10岁,11岁,12岁",22
547327221986,创意小车模型可爱Q版滑行口袋玩具车儿童礼物  地摊货源热卖批发,0.59,其它玩具,"2岁,3岁,4岁,5岁,6岁",3
546275765548,儿童沙滩玩具车套装批发挖沙玩具 宝宝沙漏洗澡戏水 铲子沙子工具,8.85,,"18个月,2岁,3岁,4岁,5岁,6岁,7岁,8岁,9岁,10岁",2
549661564014,捏捏叫小鸭子游泳圈海洋球婴儿戏水套装 儿童宝宝1-3岁洗澡小玩具,1.69,,"12个月,18个月,2岁,3岁",2
540662291619,创意益智公主玩具女孩生日礼物礼盒单个婚纱新娘女童玩具娃娃热卖,10.9,普通娃娃,"2岁,3岁,4岁,5岁,6岁,7岁,8岁,9岁",2
550997388851,早教益智宝宝认知叠叠乐套圈玩具叠叠圈叠叠高婴幼儿玩具6-12个月,4.9,其它玩具,"3个月,6个月,12个月,18个月,2岁,3岁",2
